{
  "schemaVersion": 2,
  "acceptanceSchemaVersion": 1,
  "serverName": "Leaf",
  "status": "maintenance",
  "mode": "pinggy",
  "loginHost": "",
  "loginPort": 0,
  "gameHost": "",
  "gamePort": 0,
  "protocol": 854,
  "onlineAcceptanceToken": "",
  "clientBuildToken": "",
  "releaseVersion": "",
  "updatedAt": "2026-10-22T10:05:37.9010723Z",
  "endpointRevision": 1098,
  "message": "Maintenance: production acceptance is not currently valid. Login is disabled."
}
